Demystifying Agentic AI with ChatGPT: Elevate Your Skills and Unlock New Potential,"Explore the power of agentic AI in this course with instructor Jules White. Jules simplifies the concept of agentic AI, helping you understand how to interact with and harness these intelligent agents effectively. Imagine agents autonomously scheduling meetings, drafting tailored reports, or even managing customer inquiries—all while you focus on strategic tasks. Learn how these agents work and gain the fundamental knowledge to start building AI in a new way, revolutionizing your approach to productivity and innovation.",Course,2025-07-19 10:10 UTC,N/A,false,N/A,
How to Get Started on Tasks You're Avoiding,"There may be times in your career when you avoid certain tasks, due to a variety of reasons. This course, taught by Ali Schiller, provides the tools and techniques to overcome task avoidance and get started on daunting tasks. Assess your energy blocks and understand the psychological factors behind procrastination. Create a personal action plan tailored to your specific needs. After this course, you'll be equipped to overcome procrastination and boost your productivity.",Course,2025-02-02 14:18 UTC,N/A,false,N/A,
Creating Your First Marketing Videos on LinkedIn Nano Tips with Shay Rowbottom,"Welcome to our <i>Nano Tips</i> series, where LinkedIn Learning creators deliver impactful lessons in literally seconds. In this installment, Shay Rowbottom teaches expert tips on creating and sharing your videos on LinkedIn to market your business. Shay explains the factors to consider when making your first video, like topics to cover, video quality concerns, and video lengths. She then explains how to use your videos as a marketing tool to get you noticed.",Course,2025-08-08 22:08 UTC,N/A,false,N/A,
Learning Functional Programming with JavaScript ES6+,"Want to write more robust, maintainable code? In this course, discover how this can be accomplished with functional programming, and learn about the functional concepts at the heart of many JavaScript frameworks and programs. Functional programming is a radically different way of writing code. While at first it may seem a bit counterintuitive, once you get comfortable with it, you may find that your code becomes much easier to maintain, as well as more performant. This course aims to teach you everything you need to know to start taking advantage of the incredible power of functional programming in your own code, starting with the basics and going all the way up to more advanced concepts such as recursion, partial application, currying, and more.",Course,2025-01-16 01:49 UTC,N/A,false,N/A,
Adaptive Leadership for Today's Challenges,"<p>Anyone who leads an organization or an organization-wide effort will tell you that things are moving faster, and the challenges are more complex. This is the reality of work, now and for the foreseeable future. To thrive in this environment, leaders must be adaptive and responsive to the rapid and ever-changing world. In this course, internationally-known systems scientist and Cornell University professor Derek Cabrera shows you the key principles of adaptive leadership. Learn how to become an adaptive leader and dive into a powerful framework that will enable your organization to tackle any problem, issue, or situation. Find out how this framework can yield innovative solutions that will have a meaningful impact for the long term. Plus, explore ways to apply the adaptive leadership tools to some of today's greatest challenges. </p><p>This course is part of a <a href=""https://www.linkedin.com/learning/paths/succeeding-as-a-senior-manager-professional-certificate-by-linkedin-learning"" target=""_blank"">Professional Certificate</a> from LinkedIn Learning.</p>",Course,2025-04-04 23:03 UTC,N/A,false,N/A,
Designing Agentic AI Products (No Code Required),"Agentic AI automates AI workflows using the reasoning power of large language models. Are you ready to go past chatbots to get agents to work for you? In this course, Sudha Jamthe takes you through the foundational knowledge of agentic AI and teaches you how to design an autonomous AI solution to automate your marketing or enterprise business workflow with no-code agentic platforms and tools.",Course,2025-06-16 02:29 UTC,N/A,false,N/A,
C#: Interfaces and Generics (2015),"Take your C# coding skills to the next level by learning to use interfaces and generics in this course with programming expert Joe Marini. Interfaces provide a way of implementing common types of behaviors that can be reused across multiple classes. Interfaces keep your code nimble, compact, and efficient. Generics, on the other hand, help you work with strongly typed data collections, without having to commit to a data type ahead of time. Used in combination, these features make your C# projects easier to build and scale, with fewer bugs and performance issues along the way. Start watching to learn how to integrate interfaces and generics into your projects today.",Course,2020-01-01 13:43 UTC,N/A,false,N/A,
Blender 2.91 Essential Training,"Blender is a powerful open-source solution for 2D and 3D modeling, animation, compositing, and post-production. In this course, get a thorough overview of the feature set in Blender 2.91 and beyond, as well as practical production techniques that combine know-how with a healthy dose of how-to. Instructor David Andrade dives into specific techniques, such as scene layout and modeling, sculpting, texturing and shading, 2D and 3D animation, character rigging, dynamic simulations, rendering, and game engine exporting. Plus, get performance-boosting tricks to get Blender to render your creations even faster. Each lesson helps you gain the control and skill you need to create professional artwork for multiple platforms: games, movies, and animation.",Course,2022-02-18 14:20 UTC,N/A,false,N/A,
CONTENT METADATA NO LONGER EXISTS - urn:li:lyndaCourse:142020,CONTENT METADATA NO LONGER EXISTS - urn:li:lyndaCourse:142020,Course,2018-07-29 11:31 UTC,N/A,false,N/A,
"Italian, Part 4: Using and Expanding Your Skills","<p>Explore the beauty and diversity of Italy’s history, culture, and cuisine as you learn how to handle real-life conversations in Italian. Tuscany is perhaps Italy’s most celebrated and popular region, and the cradle of the Renaissance. This course—the fourth in a four-part series from The Great Courses covers Tuscany's breathtaking medieval cities, beloved food specialties, and iconic artists and writers. See how the <i>passato prossimo</i> tense is used with the auxiliary verb ""essere."" Study expressions of time, and practice your skills in describing the life of Florentine painter Sandro Botticelli.</p>

<p><b>About the instructor</b><br><br>
Kristina Olson is an associate professor of Italian and the Italian program coordinator at George Mason University, where she has taught Italian language, literature, and cinema since 2005. She earned her PhD in Italian from Columbia University. Professor Olson is the author of <i>Courtesy Lost: Dante, Boccaccio, and the Literature of History</i> and several articles on Dante, Boccaccio, and Petrarch. She is the coeditor of <i>Open City: Seven Writers in Postwar Rome</i>; <i>Boccaccio 1313–2013</i>; and the second edition of <i>Approaches to Teaching Dante’s Divine Comedy</i> with the Modern Language Association. Professor Olson is the president of the American Boccaccio Association and was the vice president of the Dante Society of America.</p>",Course,2025-08-09 15:05 UTC,N/A,false,N/A,
Breaking the Anxiety Habit,"<p>For many of us, anxiety is a partner on our journey of life: it is always there. But a helpful reframe could also be the idea that anxiety is a habit we have created. And the good news is that habits are something we can break. In this course, two well respected experts—Dr. Judson Brewer and Charles Duhigg—weigh in on how to recognize the anxiety habit at work, as well as steps you can take to break the habit. </p>

<p>This course was created by Morra Aarons-Mele of The Anxious Achiever. We are pleased to offer this insightful discussion in our library.</p>",Course,2025-02-20 22:53 UTC,N/A,false,N/A,
Nano Tips to Thrive in Uncertainty and Embrace Change with Shadé Zahrai,"<p>Welcome to our <i>Nano Tips</i> series, where LinkedIn Learning creators deliver impactful lessons in literally seconds. In this installment, discover powerful, practical strategies to grow your career by thriving in uncertainty and embracing change with insights from Shadé Zahrai, peak performance researcher and behavioral strategist to Fortune 500 companies.</p><p>Start embracing change in your professional life by tapping into your brain’s learning powerhouse. Learn how to identify communication preferences, transform anxiety into opportunity, cultivate resilience, manage stress, overcome the effects of tunnel vision, embrace acts of microbravery, and accept what you cannot change. Along the way, Shadé shows you how to successfully confront your fear of change and lead more authentically in times of uncertainty.</p>",Course,2025-08-04 21:18 UTC,N/A,false,N/A,
The AI-Driven Product Designer,"In this course, Drew Falkman—a product strategist and startup advisor—explores how AI is transforming software product design and management in this comprehensive course. Learn to leverage advanced AI tools to optimize product strategy, UX research, prototyping, and code development. Identify key insights faster than ever using enhanced methods for user research and analytics with tools like Craft Full and Strela. Utilize tools like Wizard, Reloom, and Figma AI to create and iterate on prototypes. Master the integration process to transform your designs into functional code using builder.io and Lovable's no-code solutions. Delve into ethical considerations and security practices to effectively manage data and AI dependencies. By the end of this course, you will be able to dramatically streamline your product design process and stay ahead in the fast-evolving tech landscape.",Course,2025-06-22 22:09 UTC,N/A,false,N/A,
Mindful Communication for Less Conflict and Stronger Relationships,"<p>In this course, communication professor Melanie Whitney teaches the foundations of mindful communication in order to speak with greater emotional intelligence, self-awareness, and conflict competence. She first helps you identify ways that your ego impacts your communication and ways to spot and lessen your reactivity while communicating. She then outlines techniques to deepen self-awareness while communicating by recognizing the ways you communicate with yourself, and shares simple mindfulness strategies to stay present during communication with others. Finally, she shows you how to navigate even the most challenging conversations through mindful listening and shares strategies to communicate in ways that invite connection and alignment.</p><p>This course includes AI-powered Role Play. Role Play allows you to practice what you’ve learned in interactive simulations of real-world conversations.</p>",Course,2025-10-10 02:03 UTC,N/A,false,N/A,
Nano Tips for Understanding AI's Impact to Business with Marco Andre,"Welcome to our <i>Nano Tips</i> series, where LinkedIn Learning creators deliver impactful lessons in literally seconds. In this course, Marco Andre offers tips on understanding the impact of artificial intelligence in business, and how leaders can  become more productive and creative at work by thinking about AI first.",Course,2025-01-25 14:41 UTC,N/A,false,N/A,
C# Algorithms,"Algorithms are one of the fundamental pillars in every software application, and once you understand them, you can create more efficient and maintainable programs. In this course, instructor Kathryn Hodge uses instruction and hands-on practice to show you how to create better C# programs by using efficient algorithms. Kathryn discusses what makes an algorithm effective, as well as how to make informed assumptions about your data to create better algorithms. She focuses on how to create efficient algorithms to work with different types of data, including strings, arrays, linked lists, queues, stacks, hash-based structures, and trees. Many algorithms are built into the C# language, and Kathryn covers how to use these to create your own custom algorithms, so you can work with your data exactly the way you want. She also dives into how to leverage different data structures to create better algorithms in analyzing or manipulating their data.",Course,2023-10-01 22:00 UTC,N/A,false,N/A,
Learning Microsoft 365 (Office 365),"Get a tour of Microsoft 365, the cloud version of Microsoft Office. In this course, David Rivers shows how to access your M365 account and work with apps, both desktop and browser versions. Dave demonstrates how to create and work with files in OneDrive and sites in SharePoint. He also introduces the basics of working with Teams, the chat/collaboration tool that has become the hub of M365.",Course,2022-07-25 15:47 UTC,N/A,false,N/A,
Pitching Yourself for Opportunity,"<p>Every conversation presents an opportunity to make a great impression. In this course, Jodi Glickman, CEO and Founder of GreatOnTheJob.com, guides you through how to craft a compelling pitch with thought and intention so you can be persuasive, memorable, and able to reach your goals. Jodi shares the fundamental framework of leading with your destination, crafting your backstory, and then connecting the dots.  She covers pitch basics (it’s a dialogue, not a monologue!), cautions against mistakes to avoid, and shares why no two pitches are ever the same. Plus, Jodi offers behind-the-scenes coaching on real-life examples of how to try out, practice, and improve your pitch.</p>",Course,2025-07-15 10:16 UTC,N/A,false,N/A,
Arabic for Absolute Beginners,"<p>Brand new to Arabic? This course is a simple but comprehensive audio course designed to be the easiest way to start learning and speaking Arabic. Learning Arabic can be easy or hard, and it all depends on <em>how</em> you start. Start the hard way (reading grammar and memorizing words), and you’ll quickly think, “Languages are just not my thing.” Start easy, and you’ll be shocked by how much Arabic you’ll learn. Learn from real native speakers to get accustomed to the flow of Arabic —which you won’t get from Apps and textbooks. Hear everyday conversations to learn practical dialogue. And start speaking everyday Arabic from your first lesson.
</p><P>
This course also includes a PDF that covers everything from the audio tracks and much more. 
</p><P>
This course was created by InnovativeLanguage.com. We are pleased to host the course in our library.",Course,2025-08-17 13:18 UTC,N/A,false,N/A,
Nano Tips for Using AI for Brand Storytelling with Ash Rathod,"Welcome to our <i>Nano Tips</i> series, where LinkedIn Learning creators deliver impactful lessons in literally seconds. In this course, Ash Rathod offers tips on how to use AI tools for inspiration, productivity, and identifying with your audience as a storyteller. Learn about the human-AI creative balance, ethical AI storytelling pitfalls to avoid, crafting better AI prompts, and more.",Course,2025-01-20 22:25 UTC,N/A,false,N/A,
Agentic AI: Building Data-First AI Agents,"In this course, Senior Staff Instructor Morten Rand-Hendriksen and Microsoft Director of Data & AI Strategy Viroopax Mirji analyze the data challenges enterprises face when building AI agents. The course examines data quality, privacy, integration, and bias, with real-world examples from industries like healthcare and autonomous vehicles. The conversation covers best practices for data management, governance, and transitioning to an AI-driven future, ensuring transparency and accountability in AI systems.",Course,2025-07-20 02:17 UTC,N/A,false,N/A,
C# Practice: Interfaces and Abstract Classes,"<p>Test your object-oriented knowledge of C# in this edition of <i>Code Challenges</i>. Instructor and .NET developer Walt Ritscher presents five hands-on, intro-level challenges focused on abstract classes and interface implementation. Each challenge examines one aspect of these topics, and after you write the code to solve the challenge, check your work against Walt’s solution.</p>
<p>This course includes Code Challenges powered by CoderPad. Code Challenges are interactive coding exercises with real-time feedback, so you can get hands-on coding practice alongside the course content to advance your programming skills.</p>",Course,2024-03-12 01:05 UTC,N/A,false,N/A,
Trauma-Informed Design,"<p>If you want to upskill as a designer, you can’t overlook the importance of a trauma-informed approach. It can improve your design efforts and deliver more caring and less harmful digital experiences. In this course, you'll learn how the six trauma-informed principles can help you design more positive and supportive experiences for everyone. These ideas apply to websites, apps, online forms, and beyond.</p><p>Learn the fundamentals of trauma, including its pervasiveness, types, impacts, and warning signs. Discover practical ways to design products and services like online forms and research protocols that care for users, participants, and designers. Join instructors and researchers Melissa Eggleston and Carol Scott as they show you what it takes to become more trauma-informed. By the end of this course, you’ll have foundational ideas to improve your design efforts and create more equitable, ethical, and welcoming experiences for all.</p>",Course,2025-03-22 09:25 UTC,N/A,false,N/A,
Apple Watch Tips and Tricks,"Apple Watch continues to evolve. In this course, Garrick Chow explores the features and capabilities of the latest Apple Watch OS, including Siri, the updated interface, and bundled app capabilities. Learn how to manage your Watch, including the haptic alert system, theater mode, and more. Discover ways you can communicate using your Apple Watch, as well as ways to view and work with apps. Get useful tips on using Siri, and learn about the variety of health and safety features that your Watch offers. Plus, find out how to take a screenshot, find your iPhone, force quit apps, and more.",Course,2025-04-16 21:49 UTC,N/A,false,N/A,
Understanding the Impact of Deepfake Videos,"Imagine not being able to trust what you see or hear when you watch a video online. Deepfakes are manipulated media—video or audio—where a person has been replaced with someone else's likeness and made to appear as if they said or did something that never happened. Deepfake videos use artificial intelligence and can appear very convincing, even to a trained eye. When used to mislead audiences, deepfake videos can be disastrous. However, they can have useful benefits too—like offering AI-assisted video reshoots. In this introductory course, senior staff instructor Ashley Kennedy offers a useful introduction to the dangers and benefits of deepfake videos. She also provides a high-level overview of deepfake technology and puts forward some tools to identify deepfake videos, as well as suggestions for what to do when you suspect or spot a deepfake video.",Course,2022-03-21 12:13 UTC,N/A,false,N/A,
Hands-On AI: Building AI Agents with Model Context Protocol (MCP) and Agent2Agent (A2A),"This course introduces you to the Model Context Protocol (MCP) and Agent2Agent (A2A) communication frameworks essential for designing context-aware, collaborative AI agents. Explore MCP architectures, tools, and implementations, and learn how to build AI applications and agents that leverage rich contextual understanding. Additionally, instructor Kumaran Ponnambalam dives into A2A's structure, workflow, and practical applications, helping you gain hands-on experience with multi-agent ecosystems. Check out this course to gain the practical knowledge to design, implement, and execute intelligent, interconnected AI agents in real-world scenarios.",Course,2025-09-22 11:40 UTC,N/A,false,N/A,
Extending Laravel with First Party Packages,"<i>Extending Laravel with First-Party Packages</i> focuses on four packages built by the official Laravel team. These packages are reliable, since they are updated with each new Laravel release, and add functionality that you can pull in as needed, without adding unnecessary bloat.<br><br>

First, discover how to extend the native authentication system and add social sign-on capabilities with Laravel Socialite. Then learn how to implement efficient search indexing and enable live search results with Laravel Scout. Next, find out how to handle payments and subscriptions, including free trials, with Laravel Cashier, and implement broadcasting and live updates—without refreshing the page—using Echo. By the end of the course, you will know how to install, configure, and leverage these packages for all of your Laravel app development needs.<br><br>

Note: This course was created and produced by Packt Publishing.",Course,2018-12-09 14:03 UTC,N/A,false,N/A,
Integrating Generative AI into the Creative Process,"<p>For creatives, artificial intelligence can’t do your job for you—nor should you want it to. However, proper use of AI can help you jumpstart your creative processive and boost your productivity. In this course, Dave Birss shows you how you can use AI to develop your creative skills, from enhancing your creativity and visualization skills to improving your writing. Then, learn how AI can inspire your work by providing better ingredients for fresh ideas. He also explains how to use AI to spark your imagination, as well as practical uses of AI that can help you implement your ideas. </p><p>This course is part of a <a href=""https://www.linkedin.com/learning/paths/human-skills-in-the-age-of-ai-by-microsoft-and-linkedin"" target=""_blank"">Professional Certificate</a> from Microsoft.</p>",Course,2025-09-13 19:17 UTC,N/A,false,N/A,
LinkedIn Recruiter: AI-Powered Talent Acquisition,"<p>Unleash the power of AI in LinkedIn Recruiter and hone the skills you need to harness cutting-edge artificial intelligence features for more efficient and effective recruiting.
This short course explores the latest AI capabilities within LinkedIn Recruiter, empowering talent acquisition professionals to utilize artificial intelligence for more efficient and effective recruiting. From AI-assisted searches to optimizing communications and managing projects, learn how to leverage the full potential of AI-driven features in LinkedIn Recruiter to streamline your hiring process and find the best candidates.</p><p>The AI features in LinkedIn Recruiter are designed with fairness measures and privacy safeguards, using structured search parameters that don't enable filtering by protected characteristics. For detailed information about AI compliance, data usage, and privacy policies, please refer to the <a href=""https://www.linkedin.com/help/recruiter/answer/a1660341"" target=""_blank"">AI-Assisted Search and Projects in Recruiter FAQ</a> page.</p><p>This course is part of a <a href=""https://www.linkedin.com/learning/paths/linkedin-recruiter-and-ai-driven-talent-acquisition-professional-certificate-by-linkedin-learning"" target=""_blank"">Professional Certificate</a> from LinkedIn Learning.</p>",Course,2025-04-19 23:14 UTC,N/A,false,N/A,
Agentic AI Business Strategy: A Conversation with Charlene Li,"In the fast-evolving world of AI, autonomous agents are reshaping business innovation, decision-making, and leadership. In this interview-driven course, AI thought leader  Charlene Li explores the world of agentic AI—AI agents capable of autonomous, adaptive actions. Gain insights into implementing AI solutions aligned with strategic goals, overcoming challenges like executive hesitation, and building trust. This course is perfect for leaders and business strategists ready to thrive in the age of intelligent agents.",Course,2025-08-15 17:39 UTC,N/A,false,N/A,
Responding to Unreasonable Customer Demands,"<p>Looking to improve your customer service skills? In this course, customer service expert Vince Lopiccola teaches essential strategies to handle unreasonable customer demands effectively. Learn how to maintain professionalism when navigating difficult customer interactions using de-escalation techniques, active listening, and boundary setting. By the end of this course, you'll be prepared to utilize practical strategies to enhance customer satisfaction and maintain composure in challenging situations.</p>
<p>This course was created by <a href=""https://www.onlymadecraft.com"" target=""_blank"">Madecraft</a>. We are pleased to host this training in our library.</p>                  
<img src=""https://media.licdn.com/media/AAYAAgCwAAoAAQAAAAAAAHppnBQxgeyWS2CsU3aDDPcMgw.jpg"" alt=""Company logo for Madecraft; the letter M configured as part of a printing press"" width=""20%"" height=""20%"" />",Course,2025-02-09 22:49 UTC,2025-02-09 19:41 UTC,false,N/A,
Reid Hoffman and Chris Yeh on Blitzscaling,"Blitzscaling is a growth strategy that prioritizes speed over efficiency in the face of uncertainty. Those bold enough to adopt it must break free from the confines of business school logic to take uncalculated risks that could just as easily lead to abject failure as rapid-fire growth. In this course, LinkedIn founder Reid Hoffman and entrepreneur Chris Yeh break down when and how entrepreneurs and other business leaders should leverage this tactic to get ahead. Reid and Chris—who literally wrote the book on this topic in 2018's <i>Blitzscaling</i>— explain how, despite the potential pitfalls, blitzscaling practices are often the key to scaling massive companies. They share examples of successful blitzscaling, explain how to blitzscale within a larger organization, and more.",Course,2021-10-09 13:31 UTC,N/A,false,N/A,
