Content Title,Content Description,Content Type,Content Last Watched Date (if viewed),Content Completed At (if completed),Content Saved,Notes taken on videos (if taken),
Arduino: Prototyping,"For designers and product managers, the Arduino family of microcontrollers and easy-to-assemble components is a valuable tool for exploring and evaluating hardware product designs. Rapid, incremental prototypes can help improve outcomes and reduce cost and time in the design process. In this course, instructor Robert Gallup helps you go beyond the basics and learn what it takes to develop Arduino-based prototypes. Robert begins by providing an overview of the prototype development process, highlighting both best practices and potential pitfalls. He then steps through how to develop and refine a proof-of-concept prototype, introducing relevant concepts and techniques along the way. After this course, you'll be ready to tackle your own hardware prototyping using Arduino. <br>
Robert also includes several hands-on challenges with solutions to help you better understand the LCD, animation dynamics, and the final process of completing your prototype and modifying it in response to feedback.",Course,2022-06-18 11:09 UTC,N/A,false,N/A,
Navigating the EU AI Act,"<p>The European Union (EU) Artificial Intelligence (AI) Act is a first-of-its-kind global regulation for trustworthy AI. Once passed into law, the act will enforce a legal framework using a risk-based approach aimed at regulating the development, deployment, and use of AI in the European Union. Companies failing to abide by the reporting and transparency requirements defined in the act will be subject to monetary repercussions.
</p><p>
In this course, Tristan Ingold examines the transformative EU AI Act. He defines AI systems in the context of the EU and identifies requirements and obligations imposed by the act on AI system providers and users. He also details the various business and technical challenges and opportunities that stakeholders will have to consider. Whether you are a developer, business leaders, risk and compliance professional, or just interested in understanding the future of AI regulation, this course should help you understand how legislative developments will impact AI systems.",Course,2025-06-09 01:06 UTC,N/A,false,N/A,
C Standard Library,"Get up to speed with the C standard library, the standardized library of functions available for the C programming language. This course covers over 60 of the most useful and popular functions, as grouped in the header files stdio.h, stdlib.h, stdint.h, string.h, and math.h. Instructor Eduardo Corpeño starts by reviewing the library's organization and familiarizing you with the header files and syntax. Then he shows how to accomplish a variety of tasks with the library: processing input and output, managing application memory, generating random numbers, sorting and searching for data, manipulating text strings, and performing math. Each chapter includes numerous examples that show the functions in practice, along with programming challenges that allow you to test your new knowledge and skills.",Course,2019-03-07 23:08 UTC,N/A,false,N/A,
CONTENT METADATA NO LONGER EXISTS - urn:li:lyndaCourse:5037960,CONTENT METADATA NO LONGER EXISTS - urn:li:lyndaCourse:5037960,Course,2020-01-12 12:28 UTC,N/A,false,N/A,
Handling Customer Complaints with Empathy,"<p>Handling customer complaints is a critical skill for maintaining satisfaction and trust. In this course, customer service expert Sara Odirisio demonstrates the importance of addressing complaints with empathy and discovering unresolved issues. From understanding different types of complaints to mastering the appropriate language, posture, and gestures, this course helps you develop the skills required to de-escalate tense situations, offering strategies for active listening, asking the right questions, handling aggressive customers, and more. Sara guides you through a practical five-step process to resolve complaints and shares tips for addressing written complaints and ensuring follow-up. By the end of this course, you’ll be better prepared to navigate customer complaints with empathy, keeping interactions calm, professional, and solution-focused.</p><p>Note: This course was created by Sara Odorisio and CRFT Productions. We are pleased to host this training in our library.</p>",Course,2025-02-14 13:42 UTC,N/A,false,N/A,
Emotional Intelligence for Project Managers (Blinkist Summary),"<i>Emotional Intelligence for Project Managers</i> builds on the writings of Daniel Goleman, who developed principles of emotional intelligence. Emotional intelligence is crucial in many aspects of life, and author Anthony Mersino tailors Goleman’s principles specifically to the needs of project managers. Discover how to develop skills such as self-awareness, self-management, and social awareness, and practice relationship management and team leadership on an advanced level. This short, audio-only course helps project managers master the people skills they need to achieve outstanding results—in under 15 minutes.<br><br>

Note: This audiobook summary was produced by <a href=""https://www.blinkist.com/?utm_source=linkedinlearning&utm_medium=partner&utm_campaign=Emotional-Intelligence-for-Project-Managers-Blinkist"" target=""_blank"">Blinkist</a>. We are pleased to host this content in our library.",Course,2024-04-30 01:53 UTC,N/A,false,N/A,
After Effects 2020 New Features,"After Effects 2020 is here. Want to know how this new version will impact your motion graphics workflow? This course covers the latest upgrade, focused around the new, more powerful Content-Aware Fill. Discover how to remove an object, create a reference frame, and remove a logo on a smooth surface with this intelligent editing tool. Instructor Mark Christiansen provides practical tips to help you get the most from this forward-looking update.",Course,2020-10-16 22:21 UTC,N/A,false,N/A,
Nano Tips to Communicate Assertively and Set Boundaries with Shadé Zahrai,"Welcome to our <i>Nano Tips</i> series, where LinkedIn Learning creators deliver impactful lessons in literally seconds. In this course, award-winning leadership strategist and peak performance educator for Fortune 500 companies, Shadé Zahrai, shares essential tips on assertive communication—and how to confidently set boundaries. Learn how to communicate assertively to reduce confrontations and improve interpersonal outcomes, set boundaries for off-hours communication, address disagreement constructively, and more.",Course,2025-08-13 01:27 UTC,N/A,false,N/A,
Learning Adobe Audition,"Adobe Audition is a powerful tool for recording, editing, enhancing, and mixing audio of all kinds. It's also a deep program that can seem intimidating at first, but don’t let that stop you from exploring. In this course, author of the official <i>Adobe Audition Classroom in a Book</i> Maxim Jago breaks it down for you, outlining the key features and processes involved in creating great-sounding audio with Audition. An ideal fit for podcasters, audio producers, and video producers working with audio, this course equips you with the skills you need to produce and share exceptional audio content on your next project.",Course,2025-01-28 13:13 UTC,N/A,false,N/A,
Introduction to AI-Native Vector Databases,"<p>The primary purpose of vector databases is to provide fast and accurate similarity search or nearest neighbor search capabilities. The integration of AI techniques in vector databases enhances their capabilities, improves search accuracy, optimizes performance, and enables more intelligent and efficient management of high-dimensional data. In this course, Zain Hasan introduces this foundational technology—which is already being used in industries like ecommerce, social media, and more. Zain covers everything from foundational concepts around AI-first vector databases to hands-on coding labs for question answering using LLMs.</p><p>This course is part of a <a href=""https://www.linkedin.com/learning/paths/vector-databases-professional-certificate-by-weaviate?u=104"" target=""_blank"">Professional Certificate</a> from Weaviate.</p>",Course,2025-05-25 15:08 UTC,N/A,false,N/A,
Copilot in PowerPoint: From Prompt to Presentation,"<p>Microsoft 365 Copilot—a new AI-powered feature available for Microsoft 365 apps—can help you create, refine, and format professional-looking presentations in a matter of seconds. In this course, join Microsoft PowerPoint MVP Julie Terberg as she shows you how to use Copilot in PowerPoint from start to finish to craft a complete and compelling presentation.</p><p>Learn how to generate an idea and enter a prompt, directing Copilot to generate new slides specific to your topic. Discover how you can use Copilot to create a presentation from an existing document or from scratch. Julie offers insights on how to refine and customize the text and pictures generated by Copilot, as well as easy-to-apply tips and tricks on using Copilot to save you time in PowerPoint.</p>
<p>
This course is part of these Professional Certificates from Microsoft:
</p>
<ul>
<li><a href=""https://www.linkedin.com/learning/paths/generative-ai-for-marketing-with-microsoft-365-copilot-professional-certificate"">Generative AI for Marketing with Microsoft 365 Copilot Professional Certificate</a></li>
<li><a href=""https://www.linkedin.com/learning/paths/build-your-generative-ai-productivity-skills-with-microsoft-and-linkedin"">Build Your Generative AI Productivity Skills with Microsoft and LinkedIn</a></li>
<li><a href=""https://www.linkedin.com/learning/paths/generative-ai-for-sales-with-microsoft-365-copilot-professional-certificate"" target=""_blank"">Generative AI for Sales with Microsoft 365 Copilot Professional Certificate</a></li>
<li><a href=""https://www.linkedin.com/learning/paths/microsoft-copilot-for-productivity-by-microsoft-and-linkedin"" target=""_blank"">Microsoft Copilot for Productivity by Microsoft and LinkedIn</a></li>
</ul></p>",Course,2025-07-05 12:05 UTC,N/A,false,N/A,
Ableton Live 12 Essential Training,"Do you work in audio recording, loop-based songwriting, or synth and sound design? In this course, music professor Rick Schmunk walks you through a variety of ways you can use Ableton Live 12 in your workflows. Rick shows you how to set up your system and use the Ableton Live user interface. He explains how to work with the browser, the Arrangement view, and the Session view. After going over how to use the MIDI Editor, how to record and edit audio, and how to work with arrangements, Rick covers plug-ins, effects racks, the live mixer, and mapping. Then he demonstrates how to make your life easier by automating graphics, editing, and clips, including real-time automation. Rick concludes with some practical advice on managing your files.",Course,2024-11-15 18:32 UTC,N/A,false,N/A,
Uncertain: The Wisdom and Wonder of Being Unsure,"<p>Most people often feel embarrassed about uncertainties or blind spots in their knowledge. But Maggie Jackson—a journalist who covers social trends, with a particular focus on technology’s impact on humanity—argues that, properly understood, our ignorance can be the secret to enhanced performance and groundbreaking ideas. In this audiobook summary, Maggie shares five big ideas from her book, <i>Uncertain: The Wisdom and Wonder of Being Unsure</i>.
 </p><p>
 
Note: This audiobook summary was created by Next Big Idea Club. We are pleased to host this content in our library.",Course,2025-10-11 19:07 UTC,N/A,false,N/A,
"Agentic AI Fundamentals: Architectures, Frameworks, and Applications","Looking to dive into the world of agentic AI? The course covers the essential concepts, architectures, and frameworks that form the foundation of autonomous agents. Explore decision-making processes, machine learning techniques, and multi-agent systems and gain practical knowledge to develop and deploy agentic AI solutions. Instructor David Linthicum also addresses the ethical and societal implications of agentic AI, as well as security and robustness considerations. Check out this course to get equipped with the skills and understanding needed to leverage agentic AI in various industries and applications.",Course,2025-06-15 11:26 UTC,N/A,false,N/A,
Technical SEO,"<p>Even if the only thing you know about SEO is what the letters S, E, and O stand for, you probably know that good content on your website only goes so far when it comes to improving visibility. In order to maximize ROI and increase leads to your business, you need technical search engine optimization. In this course, SEO expert Dana DiTomaso shows how to optimize your website for SEO by looking at how crawlers work, developing strategies for increasing site speed and discoverability, using schema, architecture, URLs, and image/video to your SEO advantage. Along the way, learn how to leverage analytics data and search results assessments to drive ongoing SEO decisions and platform iterations. In addition to the actual nuts and bolts of SEO, Dana also covers the importance of making concrete recommendations to IT teams and web developers, so you can actually get the fixes implemented that you need. </p><p>This course is part of a <a href=""https://www.linkedin.com/learning/paths/digital-marketing-professional-certificate-by-content-marketing-institute"" target=""_blank"">Professional Certificate</a> from Content Marketing Institute.</p>",Course,2025-03-29 11:38 UTC,N/A,false,N/A,
Ethical Hacking: Social Engineering,"<p>Social engineering is a technique hackers use to manipulate end users and obtain information about an organization or computer systems. In order to protect their networks, IT security professionals need to understand social engineering, who is targeted, and how social engineering attacks are orchestrated.</p><p>In this course, cybersecurity expert Lisa Bock discusses the methods a hacker might use, including embedding malicious links and attachments in emails and using mobile devices and social media to deploy an attack. She discusses the concept of ""misuse of trust""—how hackers use charm, power, and influence to penetrate an organization—and why you need to be extra cautious with the disgruntled employee. Finally, Lisa discusses countermeasures security professionals can take to address these attacks.</p><p>Note: This course maps to the Social Engineering competency of the Certified Ethical Hacker exam. You can review the exam objectives on the official <a href=""https://www.eccouncil.org/programs/certified-ethical-hacker-ceh/"" target=""_blank"">EC-Council website</a>.</p>",Course,2024-07-11 15:51 UTC,N/A,false,N/A,
Machine Learning Fundamentals for Healthcare,"<p>There’s an increased demand to integrate AI and machine learning workflows into many different business sectors. This is especially true in today’s unique and constantly evolving global healthcare landscape.</p><p>In this course, instructor Wuraola Oyewusi provides an overview of how AI and machine learning can optimize healthcare processes, data analysis, health outcomes, and more. Along the way, gather insights drawn from real-world examples to address complex privacy and ethical considerations in the industry. Wuraola also shows you how to utilize machine learning for tabular healthcare datasets using a Google Colab Notebook, including clinical records, classification, predictions, regression, clustering, and localization.</p>",Course,2024-07-19 09:33 UTC,N/A,false,N/A,
Nano Tips to Project Confidence and Executive Presence with Shadé Zahrai,"<p>Welcome to our Nano Tips series, where LinkedIn Learning creators deliver impactful lessons in literally seconds. In this course, behavioral strategist and global peak performance consultant to Fortune 500 companies Shadé Zahrai shows you frameworks that will support you in building genuine connections, speaking with precision, and maintaining poise. Learn ways to project confidence in your communication, refine your presence using concise messages, and reinforce your credibility through a confident posture. Plus, learn to amplify your influence with  a positive presence, asking thoughtful questions, and communicating with credibility.</p>

<p>This course was created by Shadé Zahrai. We are pleased to host this training in our library.</p>",Course,2025-10-15 23:52 UTC,N/A,false,N/A,
Jodi Glickman on Pitching Yourself (2018),"Pitching is a universal skill. The time will come when you need to pitch an idea, a project, or even yourself. But you may stumble when the moment strikes—if you don't have a quick and effective process to nail the pitch. In this free course, thought leader Jodi Glickman shares her go-to approach for selling your ideas, your story, and yourself. Learn three easy steps to a successful pitch: destination, backstory, and connecting the dots.",Course,2018-12-29 11:16 UTC,N/A,false,N/A,
Confident Performance: Excelling When It Counts,"Does confidence come from being great at what you do? Or does feeling confident actually lead you to becoming great? In this course, TJ Guttormsen teaches you how to perform confidently, no matter what level of skill you currently have—without veering into being delusional or arrogant. TJ explains how to create realistic expectations for your outcomes and abilities, and how to communicate those to others so that even when you know that you're not great at something (yet), you can still do it without feeling nervous or stressed.
Learn how to deal with and understand your own confidence-hindering emotions; minimize self-imposed pressure and overcome perfectionism, self-doubt, fear of judgment; deal with stress during your performance; and more.",Course,2024-12-27 23:18 UTC,N/A,false,N/A,
Nano Tips for Leading Diverse Teams with Watchen Nyanue,"<p>Welcome to our <i>Nano Tips</i> series, where LinkedIn Learning creators deliver impactful lessons in literally seconds. In this installment, join Watchen Nyanue Hampton—thought leader, career architect, and the founder of I Choose The Ladder—as she shares practical, easy-to-use strategies for navigating diverse team dynamics and reaching your full leadership potential.</p><p>Learn how to bridge the gap between effort and attitude, find comfort in discomfort, and value everyone’s unique lived experience. Get tips on establishing rules of engagement and creating clearly defined communication channels. Along the way, Watchen offers insights to help you build your awareness of team blindspots, embrace conflict, rotate meeting leadership, practice mindful communication, and celebrate success. By the end of this course, you’ll be equipped with the skills you need to lead your team with professional poise and aplomb.<p>",Course,2025-03-21 15:36 UTC,N/A,false,N/A,
Generative AI Tools for Productivity and Research,"Artificial intelligence is growing rapidly, affecting nearly every industry, and it’s not going anywhere. If you’re feeling overwhelmed by the onslaught of AI tools or just feeling out of the loop with the speedy changes in the AI landscape, check out this course with instructor Wuraola Oyewusi. Wuraola explores a wide range of generative AI tools from text to image, language generation with chatbots (Google Gemini, Microsoft Copilot), research (Elicit AI, Litmaps, SciSpace). She shows you how to write, visualize, extract, parse, search, and distill scientific and academic research content. Learn about getting set up, prompting, finding the right tool, and more, and discover how you can use generative AI tools to improve research productivity.",Course,2025-06-28 18:33 UTC,N/A,false,N/A,
DevOps Foundations: Lean and Agile (2017),"By applying lean and agile principles, engineering teams can deliver better systems and better business outcomes—both of which are crucial to the success of DevOps. In this course, instructors Ernest Mueller and Karthik Gaekwad discuss the theories, techniques, and benefits of agile and lean. Learn how they can be applied to operations teams to create a more effective flow from development into operations and accelerate your path of ""concept to cash."" In addition to key concepts, you can hear in-the-trenches examples of implementing lean and agile in real-world software organizations.",Course,2021-07-23 02:50 UTC,N/A,false,N/A,
Learning Google Tag Manager,"Google Tag Manager is a hugely popular technology that allows marketers to easily manage all their website and app tags from one central tool. This, in turn, frees marketers from their dependency on IT or web development departments—when they want to add or alter a snippet of analytics or tracking code, they can do it themselves by adding it to the existing tag container. This course shows marketers how to effectively leverage Google Tag Manager. Discover how to best work with accounts and containers, leverage the Google Analytics built-in tags, work with control versions and user access, create custom variables and JavaScript, fire Google Analytics events using triggers, and more. Plus, discover crucial time-saving best practices that will help you avoid many common mistakes.",Course,2024-08-07 00:40 UTC,N/A,false,N/A,
Developing Executive Presence,"Learn to project self-confidence, clarity, and credibility even under conditions of stress, pressure, and uncertainty. In this course, John Ullmen, PhD, a professor from the UCLA Anderson School of Management, shares key research insights and step-by-step methods he uses to coach leaders around the world to develop executive presence. He outlines the four key factors that drive executive presence, and the specific actions that make them work for you.  He also explains the difference between internal and external presence, and how to enhance both to increase your self-assurance and self-possession. He addresses how to do all of this without being fake or feeling inauthentic, and how to be ""fully present, persistently.""",Course,2018-12-29 11:07 UTC,N/A,false,N/A,
Nano Tips to Build Authority on LinkedIn with Shadé Zahrai & Jasmin Alić,"Welcome to our <i>Nano Tips</i> series, where LinkedIn Learning creators deliver impactful lessons in literally seconds. In this course, Shadé Zahrai and Jasmin Alić show you how to create impactful LinkedIn content that delivers real value, builds engagement, and strengthens professional connections. Develop skills to format posts effectively, engage with comments, and subtly showcase their expertise without sounding overly promotional. Through storytelling, video strategies, and permission-based selling, learn how to enhance your LinkedIn presence and create content that resonates with your audience.",Course,2025-10-07 02:35 UTC,N/A,false,N/A,
Managing Anxiety Triggers with Effective Techniques,"<p>Imagine you are having an anxious moment at work. Instead of letting yourself slip into old patterns of negative thoughts or self-criticisms, you can take a step back and try something new. Maybe move around, go out for lunch, drink some water—just don’t start doom scrolling. Emma Seppala is a lecturer at Yale, and in this course, she details techniques on how to manage anxiety. Emma explains that anxiety is telling you something, and by asking yourself ""what do you need?"" you can reclaim your power and energy. Check out this course to learn how to better deal with anxiety and stop subjecting yourself to self-destructive beliefs and behaviors. 
</p><p> 
This course was created by Morra Aarons-Mele of <i>The Anxious Achiever</i>. We are pleased to offer this insightful discussion in our library.",Course,2025-02-19 02:06 UTC,N/A,false,N/A,
Nano Tips for Career Success and Daily Wins with Shadé Zahrai,"<p>Welcome to our <i>Nano Tips</i> series, where LinkedIn Learning creators deliver impactful lessons in literally seconds. In this installment, explore strategies for career success and daily wins with award-winning leadership strategist and peak performance specialist Shadé Zahrai. Learn how to identify career growth areas, address burnout, track achievements, celebrate effort, balance skills with opportunities, and develop daily habits. By the end of this course, you’ll be prepared to manage emotionally charged situations, disrupt procrastination, and improve mental clarity and well-being.</p><p>This course was created by Shadé Zahrai. We are pleased to host this training in our library.</p>",Course,2025-10-13 03:58 UTC,N/A,false,N/A,
Advanced LLMs with Retrieval Augmented Generation (RAG): Practical Projects for AI Applications,"Are you an engineer, solutions architect, or software developer tasked with building enterprise applications? It’s time to get up to speed with the latest AI-powered tools and techniques—in this case, retrieval-augmented generation (RAG). In this course, designed by leading technology educator Pragmatic AI Labs, join instructor Guy Ernest as he outlines the foundational and advanced concepts required to leverage RAG for large language models, including text encoding using embedded vectors, document chunking with enrichment strategies, improving document retrieval, and more. By the end of this course, you’ll be equipped with the skills you need to take advantage of the power of RAG.",Course,2025-08-20 22:16 UTC,N/A,false,N/A,
