Build AI Agents and Automate Workflows with n8n,"Use n8n - the open source workflow automation tool - to build advanced custom AI-powered business-process automations connecting your existing tools together to create AI agents that simplify your work. Choose n8n as a cloud app, mount it on prem, or run it locally on your computer for full control. Learn how to build an advanced AI agent that connects with external sources like Google Sheets and Slack to perform data processing and management based on natural language inputs. Create, share, and test out automation flows with your team and the n8n community.",Course,2025-09-26 11:53 UTC,N/A,false,N/A,
How to Use Generative AI: Building an AI-First Mindset,"<p>Creating real impact with AI means understanding what generative AI is capable of today—and using that knowledge to stay ahead of future developments. Regardless of your industry, role, and experience, AI can transform your personal and professional development. If you want to learn how to unlock your full potential with AI, this course is for you.
</p><p>
In this course, AI thought leader, advisor, and investor Allie K. Miller provides her insights and guidance on how to thrive in the AI age. She shares real-world examples of generative AI tools in action, as well as her most-used framework to leverage AI to generate added value. Learn how to seamlessly integrate AI into your workflows, enhancing both individual and team productivity. Get the knowledge and tools to use AI for strategic planning, decision-making, and creative problem-solving. By adopting an AI-first mindset, you’ll be better prepared to future-proof your career and lead AI-driven transformations within your organization.",Course,2025-09-12 01:52 UTC,N/A,false,N/A,
A Playbook to Achieve Equity Anywhere,"""Equity"" is a definable goal, and you can measure your efforts quantitatively and qualitatively measured against it. In this course, DEI strategist and bestselling author Lily Zheng helps you get motivated to take equity-related learning seriously and primes you to think in terms of pragmatism and accountability. Review foundational concepts like equity for healthy workplaces, targeted universalism, and how inequity manifests itself in the workplace. Learn how to assess your outcomes, uncover the why behind equity gaps, and prepare for change-making efforts. Explore effective ways to intervene intentionally. Plus, find out how to measure the impact of your equity efforts, celebrate progress, and continue your forward momentum.",Course,2025-03-16 22:43 UTC,N/A,false,N/A,
Nano Tips to Boost Productivity with Shadé Zahrai,"Welcome to our Nano Tips series, where LinkedIn Learning creators deliver impactful lessons in literally seconds. In this course, peak performance researcher and behavioral strategist to Fortune 500 companies Shadé Zahrai teaches tips for increasing your productivity. Shadé shows you techniques to help you start your tasks more efficiently and provides strategies to help you maintain your focus. She also shares some essential productivity principles to help you recalibrate your mindset and boost your productivity.",Course,2025-08-22 18:46 UTC,N/A,false,N/A,
Translating Cybersecurity for SMBs - Using the NIST Cybersecurity Framework 2.0,"Cybersecurity can often be an intimidating topic for SMBs. In this course, EVP and cybersecurity engineer Kelly Hood puts cybersecurity into context and leverages the NIST Cybersecurity Framework to establish a foundation for organizing capabilities and goals to make sure you’re focused on what matters most. Kelly breaks down complex cyber topics and guides you through examples of how you, as a SMB, can secure your organization today. She frames this training around the recently updated NIST Cybersecurity Framework 2.0 to ensure that you will be prepared to communicate with business leaders within your organization, as well as external partners that have a stake in your cybersecurity.",Course,2025-06-21 11:08 UTC,N/A,false,N/A,
Learning Ansible,"Ansible is a popular open-source tool that provides automation, configuration management, and orchestration all in one. In this course, instructor Greg Sowell introduces Ansible and explains the many reasons that system administrators and DevOps engineers choose to keep Ansible in their IT tool kit. Learn how to install Ansible in different environments and work with hosts, variables, inventories, and playbooks. Practice your new deployment and playbook writing skills with the exercise challenges at the end of each section. Along the way, Greg reviews various use cases and practical examples to highlight how Ansible can solve a variety of real-world problems more effectively and efficiently.",Course,2025-03-23 22:59 UTC,N/A,false,N/A,
Skills to Build Stronger Work Relationships,"<p>In the world of hybrid work, uncertainty, and constant change, people need healthy work relationships to feel supported and show up as their best selves, This course teaches essential skills to build and maintain more resilient relationships.
Dr. Emily Anhalt teaches essential tools and skills, including: taking ownership of your part, strategies to build empathy, ways to create a more positive and safe working environment, ways to move from reactive to proactive, how to have healthy conflict, getting on the same team, expressing yourself more effectively, and breaking an emotional sweat every day.</p><p>This course is part of a <a href=""https://www.linkedin.com/learning/paths/becoming-a-manager-professional-certificate-by-linkedin-learning"" >Professional Certificate</a> from LinkedIn Learning.</p>",Course,2025-07-10 10:51 UTC,N/A,false,N/A,
CONTENT METADATA NO LONGER EXISTS - urn:li:lyndaCourse:2483198,CONTENT METADATA NO LONGER EXISTS - urn:li:lyndaCourse:2483198,Course,2022-11-24 00:29 UTC,N/A,false,N/A,
Learning Personal Branding,"You are the most powerful marketing tool at your disposal. If you are starting a business, establishing your thought leadership, or trying to get ahead in your career, it's a great time to start investing in the brand of you. Learn the secrets of personal branding in this course with marketing expert Chelsea Krost. Chelsea explains how to develop your story, craft your messaging, and define your audience. Then she walks you through building your brand presence online and off, creating a calendar that will help you stay on top of social media and keep your content fresh. Plus, get tips to monetize your personal brand and land speaking engagements and guest roles.",Course,2020-11-13 01:17 UTC,N/A,false,N/A,
Nano Tips to Uncover Your Strengths with Shadé Zahrai,"<p>Welcome to our <i>Nano Tips</i> series, where LinkedIn Learning creators deliver impactful lessons in literally seconds. In this installment, explore the power of uncovering your inner strengths and managing your weaknesses to promote personal growth.</p><p>Join peak performance researcher and behavioral strategist Shadé Zahrai to learn the secrets of identifying and evolving your strengths with a genuinely curious, growth-focused mindset. Unearth your best possible self and start building on the innate qualities of your character, gathering feedback, unlocking your full potential, seeking balance, and finding your flow state. Along the way, Shadé shows you how to scrutinize your weaknesses to weed out bad habits, play to your strengths, and invest in your future self.</p>",Course,2025-07-28 23:44 UTC,N/A,false,N/A,
Drawing Vector Graphics: Hand Lettering,"Typography and lettering are distinct yet intimately interwoven art forms. While typography relies on established fonts, lettering relies on the hand of an artist. However, since hand lettering, like typography, is usually destined for print or the web, it's critical for illustrators to be able to transform their letterform drawings into pristine vector graphics. In this installment of <em>Drawing Vector Graphics</em>, Von Glitschka takes members through the entire creative process of hand lettering: starting with analog drawing tools, then using Adobe Illustrator to turn his drawings into vector graphics that can be further customized and scaled up or down. Von also introduces styling tips to create more compelling graphics and examples from some of the industry's best artists.",Course,2025-03-03 22:36 UTC,N/A,false,N/A,
Building Agentic AI Systems,"This course provides knowledge on how to design agentic AI systems, a rapidly evolving field that focuses on AI systems capable of autonomous decision-making and adaptive learning. Instructor Rashim Mogha shares insights into the tools, frameworks, and reference architectures. By the end of the course, with the help of a use case and project, you should have a comprehensive understanding of how to develop agentic AI systems that transform operations, unlock new opportunities, and shape the future of intelligent collaboration.",Course,2025-09-27 12:55 UTC,N/A,false,N/A,
Breaking Free From Micromanagement,"<p>Strong leadership skills are foundational to a successful career—regardless of your role. An effective leadership approach is key for your team to reach its full potential. In this course, leadership professor Dr. Julia Milner from EDHEC Business School shares practical wisdom to help leaders recognize, handle, and prevent micromanaging in the workplace. Dr. Julia Milner is a renowned leadership expert with extensive experience in coaching and developing leaders. Find out how to recognize the underlying need for control and anxiety that often drives micromanaging behavior. Delve into the negative impacts of being micromanaged on mental health and productivity. Get started with universal principles such as recognizing micromanaging tendencies and developing strategies to prevent them. Explore techniques for handling micromanaging behavior effectively and promoting a healthier work environment. Plus, discover ways to create a supportive team culture that fosters trust and autonomy. </p>

<p>This course was created by Morra Aarons-Mele. We are pleased to host this training in our library.</p>",Course,2025-04-07 21:39 UTC,N/A,false,N/A,
Demystifying ChatGPT and Generative AI: What Every Professional Needs to Know,"Unlock the secrets of AI in this course with instructor Jules White. This course breaks down complex AI concepts into simple, easy-to-understand lessons, making generative AI accessible to everyone. Learn how to effectively integrate ChatGPT into your professional toolkit, boosting productivity, creativity, and innovation. Business leaders will gain strategic insights to effectively innovate and drive their organizations forward. Whether you're new to AI or looking to enhance your understanding, this course provides the essential knowledge and skills you need to stay ahead in the evolving digital landscape.",Course,2025-02-21 13:30 UTC,N/A,false,N/A,
Building a Generative AI Music Visualizer with JavaScript and React,"In this course, learn how artificial intelligence technologies generate and manipulate visual content, enabling innovative applications in digital art and design. This knowledge empowers creators to leverage AI in crafting visuals, revolutionizing the fields of graphic design, entertainment, and media production. Instructor Eve Porcello takes you through the entire process of creating a generative AI music visualizer, from setting up a React application with Next.js, to using the ml5 library to incorporate AI functionalities, to enhancing your app with effects and color changing characteristics.",Course,2025-09-19 11:57 UTC,N/A,false,N/A,
Building a Superstar Brand,"Ever wondered what it takes to create your own brand and become a superstar along the way? Explore the value of storytelling, vision, and commitment in this course with World Wrestling Entertainment (WWE) chief brand officer Stephanie McMahon, as she shows you how to lead by example and leave a legacy in your wake. Learn key lessons from Stephanie’s hard-earned experiences and colorful tales of growing up in an entrepreneurial culture. The course shares valuable lessons on how to scale superstar partnerships, create a rich DEI culture, and build powerful fan relationships. Discover proven leadership strategies and tips that you can apply to your own venture or job. Throughout the course, Stephanie looks back on the sacrifices her parents made back when they were first promoting the WWE, growing it from nothing to superpower status, and inspiring millions around the world.<br><br>Note: This course was created by genconnectU. We are pleased to host this training in our library.",Course,2023-04-23 13:53 UTC,N/A,false,N/A,
Postman Essential Training,"<p><b>Suggested prerequisites</b></p>
<ul>
<li>A basic understanding of the command line</li>
<li>A basic understanding of HTTP requests</li>
</ul>
<p><b>Projects</b></p>
<ul>
<li>Add variables to the URL and body of a request.</li>
<li>Write your own status, header, and body assertions for a Postman request.</li>
<li>Write assertions for complicated JSON responses, including responses in arrays and in nested objects.</li>
</ul>
<p>This course introduces the process of writing, running, and automating API tests with Postman. Instructor Kristin Jackvony explains what to test in an API endpoint, along with how to use authentication tokens in an API call, write good assertions, create test collections, and how to run the test collections from the command line.</p>",Course,2025-06-04 21:38 UTC,N/A,false,N/A,
Nano Tips for Understanding Your Analytics with Shadé Zahrai,"<p>Welcome to our <i>Nano Tips</i> series, where LinkedIn Learning creators deliver impactful lessons in literally seconds. In this installment, join award-winning leadership strategist and peak performance specialist Shadé Zahrai as she shares practical, actionable advice on leveraging the power of LinkedIn Analytics.</p><p>Learn how to use LinkedIn Analytics to develop data-driven strategies to analyze audience trends, refine messaging, and optimize content, ensuring impactful engagement and meaningful connections with your followers. Shadé shows you how and why applying data-driven insights can let you more effectively plan future posts, troubleshoot underperforming content, build lasting relationships with your audience, and more. By the end of this course, you’ll be prepared to create with more intentionality, instead of just chasing virality or feeling like analytics is guesswork.</p><p>This course was created by Shadé Zahrai. We are pleased to host this training in our library.</p>",Course,2025-09-15 13:49 UTC,N/A,false,N/A,
Nano Tips for Peak Performance with Shadé Zahrai,"Welcome to our <i>Nano Tips</i> series, where LinkedIn Learning creators deliver impactful lessons in literally seconds. In this installment, find out how to supercharge your performance, exploring key insights and techniques from peak performance researcher and behavioral strategist to Fortune 500 companies, Shadé Zahrai.  
<br><br>
Learn how to optimize your brain power, habits you can establish for success, and how you can set up a commitment to excellence to level up your career and performance for the long term.",Course,2025-04-02 22:38 UTC,N/A,false,N/A,
Logo Design: Visual Effects,"Many times, a designer will have a concept for a logo, such as a bird in flight, but struggle with how to communicate that rather simple idea in a new and dynamic way. Bill Gardner, founder of LogoLounge, has been looking at, tracking, and writing about logo design styles for over thirty years. In this course he will walk members through six different visual effects that will help communicate your ideas more effectively. You'll learn how transparency can communicate a promise of clarity, how texture and light tell stories, and how three-dimensional shapes make your ideas almost touchable. Incorporate these effects into your designs and turn ""nice"" logos into ones that capture the hearts and imaginations of clients and their customers.",Course,2025-04-06 19:15 UTC,N/A,false,N/A,
OpenAI API: Agents,"AI agents generate plans and perform complex multi-step tasks based on the user input. The OpenAI API provides comprehensive support for building AI agents that use models, tools, knowledge and memory, audio and speech, guardrails, orchestration, and MCP that can be customized to fit specific needs and scenarios. This course explores how to develop advanced agents with the OpenAI API and the Agents Python SDK. Through videos, articles, and hands-on practice in GitHub Codespaces, you’ll define custom agents, set up agent runners, configure handoffs so agents can work together, add guardrails for content moderation, and extend the agents with off-the-shelf OpenAI features, custom functions, and MCP (Model Context Protocol) servers.",Course,2025-08-06 00:52 UTC,N/A,false,N/A,
Nano Tips to Stop Overthinking with Shadé Zahrai,"Welcome to our <i>Nano Tips</i> series, where LinkedIn Learning creators deliver impactful lessons in literally seconds. In this installment, unlock the secrets of living your life without the burden of overthinking, using key insights from award-winning leadership strategist and peak performance specialist Shadé Zahrai.<br><br>Learn how to stop picking apart or criticizing everything you say and do. Discover practical strategies to develop a mindset that doesn’t prevent you from achieving your goals. Find out more about how overthinking can be so detrimental to your career, your relationships, and your personal and professional life. Along the way, Shadé shows you how to gear yourself up for more positive thinking to move from worry to action with ease.",Course,2025-08-03 16:24 UTC,N/A,false,N/A,
Photoshop One-on-One: Mastery,"Discover how to be the best Photoshop user you know with reigning expert Deke McClelland. In this final installment of his comprehensive three-part <i>One-on-One</i> series, Deke explains how Photoshop works at its highest level. Get around Photoshop more quickly by loading dozens of new and revised keyboard shortcuts. Experience the power of Smart Filters, dynamic effects, and such seemingly mundane (but secretly awesome) topics as blur and noise. Discover how to mask images with the Calculations command, and manipulate paths with the Pen tool. Learn how to assemble 360° panoramas and work with such exotic features as layer comps, artboards, and actions. Leave each chapter with a sense of real accomplishment that you can apply to your own marketable, eye-popping artwork.",Course,2024-08-26 02:50 UTC,N/A,false,N/A,
Nano Tips for Effective Sponsorship as a Leader with India Gary-Martin,"Welcome to our <i>Nano Tips</i> series, where LinkedIn Learning creators deliver impactful lessons in literally seconds. In this course, India Gary-Martin offers tips and considerations when becoming a sponsor in leadership. Learn best practices for becoming a sponsor, how to give and receive the most benefit from sponsorship, and more.",Course,2025-08-14 01:14 UTC,N/A,false,N/A,
Nano Tips for Interpersonal Communication with Shadé Zahrai,"Welcome to our <i>Nano Tips</i> series, where LinkedIn Learning creators deliver impactful lessons in literally seconds.  In this course, award-winning leadership strategist and peak performance educator for Fortune 500 companies Shadé Zahrai shares tips for improving interpersonal communication skills. Shadé explains the importance of choosing words that foster collaboration, shows how you can transform your communication with positive reinforcement, describes the biggest conversation buzzkill, and more.",Course,2025-08-12 11:18 UTC,N/A,false,N/A,
Nano Tips for Smarter Learning and Better Relationships with Shadé Zahrai,"Welcome to our <i>Nano Tips</i> series, where LinkedIn Learning creators deliver impactful lessons in literally seconds. In this course, peak performance researcher and behavioral strategist to Fortune 500 companies Shadé Zahrai shares tips and strategies for building continuous growth—both personal and formulaic—that will enhance your ability to interact with people and strengthen relationships.",Course,2025-04-02 03:07 UTC,N/A,false,N/A,
Body Language for Leaders (2015),"Research shows that when your verbal and nonverbal signals are out of alignment, people are forced to choose between what they hear and what they see. And subconsciously, they'll believe your body language. In this course, workplace body-language expert Carol Kinsey Goman, PhD, reveals how body language is perceived and often misread, and shares the six nonverbal signals you need to know to make a positive first impression. She also discusses the importance of body language for leaders, and shows how you can establish leadership presence. Lastly, she provides simple and effective tips on communicating with gestures and stance.",Course,2017-07-17 18:36 UTC,N/A,false,N/A,
How to Reduce the Obstacles of Ageism While Job Searching,"<p>Ageism is a common obstacle for job seekers on both sides of the age spectrum. Young and old alike often face crushing odds. And yet, it's even more difficult for older job seekers because of conscious and unconscious biases held by decision-makers in positions of power. While it shouldn't be the exclusive responsibility of older job seekers to overcome ageism while looking for work, there are steps that you can take to minimize the obstacles and make the process less challenging—and more rewarding—along the way.</p><p>Join <i>Yahoo Finance</i>'s Kerry Hannon, a well-known author on aging and retirement, as she sits down to talk with LinkedIn News Editor Andrew Seaman on the podcast <i>Get Hired</i>. Gather tips and insights from Kerry to help you overcome the professional hurdles presented by ageism, including strategies for approaching today’s ever-evolving job market, developing the right mindset, navigating the interview process, and more.</p>",Course,2025-04-14 23:55 UTC,N/A,false,N/A,
Leading with Generative AI: Master Change Management for Success,"Master the integration of generative AI within organizational change management in this comprehensive course designed for business leaders and transformation specialists. Through 15 focused modules, instructors Christopher White and Bob Higgins offer insights on how to navigate the unique challenges of implementing AI technologies while maintaining organizational stability and growth. This course introduces the innovative FASTER framework, a structured approach specifically designed for AI-driven transformations. Along the way, explore the historical context of AI compared to past technological innovations, strategic approaches to workforce adaptation and development, practical implementations of the FASTER framework for AI integration, methods for building organizational readiness and acceptance, techniques for sustainable change management in the age of AI, and strategies for measuring and replicating transformation success.",Course,2025-01-24 11:26 UTC,N/A,false,N/A,
The Practicing Photographer,"<p>In <i>The Practicing Photographer</i>, photographer and teacher Ben Long shares a weekly serving of photographic instruction and inspiration. Each installment focuses on a photographic shooting scenario, a piece of gear, or a software technique. Each one concludes with a call to action designed to inspire you to pick up your camera (or your mouse or smartphone) to try the technique for yourself.</p><p>Note: Because this is an ongoing series, viewers will not receive a certificate of completion.</p>",Course,2025-02-22 13:09 UTC,N/A,false,N/A,
Nano Tips for More Effective Meetings with Shadé Zahrai,"Welcome to our <i>Nano Tips</i> series, where LinkedIn Learning creators deliver impactful lessons in literally seconds. In this course, peak performance researcher and behavioral strategist to Fortune 500 companies Shadé Zahrai shares quick tips for running more productive meetings. Shadé explains how to optimize meeting dynamics, maximize individual contributions, and strategically structure meetings for peak performance. Plus, learn how to continuously rate and improve your meetings.",Course,2025-08-01 23:20 UTC,N/A,false,N/A,
Model Context Protocol (MCP): Hands-On with Agentic AI,"The Model Context Protocol (MCP) allows developers to add agent behavior to LLMs by providing a universal protocol providing context to language models so they can interface with data and applications in a consistent way. MCP servers expose resources (data), tools (actions), and prompts (instructions) for the LLM and the user to use in performing more complex operations. In this course you’ll explore how the MCP works in Claude Desktop to extend its functionality, and you’ll build your own MCP servers using Python and TypeScript to give LLMs new capabilities to do things on the computer, connect with external APIs, and perform advanced multi-step actions.",Course,2025-09-04 12:14 UTC,N/A,false,N/A,
GitHub Actions Cert Prep by Microsoft Press,"GitHub Actions makes it easy to automate all your software workflows with world-class CI/CD. Build, test, and deploy your code right from GitHub. This course with instructor Tim Warner imparts the necessary skills and knowledge to understand how your customers can use GitHub Actions to automate their software development workflows. Whether you are a seasoned GitHub Actions user or someone who wants to deeply learn the most important aspects of GitHub Actions, this course is for you. Learn how to author and maintain workflows, consume workflows, author and maintain actions, and manage GitHub actions for the enterprise.",Course,2024-04-03 21:58 UTC,N/A,false,N/A,
